{
  "contract_version": 1,
  "description": "Trusted maximum write roots and required cross-issue boundaries for planning. Committed policy, not model output: a generated plan may narrow these, never widen them.",
  "default_write_roots": [],
  "issues": {
    "18": {
      "write_roots": [
        "libs/property-tax-adapters/",
        "docs/engineering/",
        "docs/sources/"
      ],
      "required_cross_issues": [
        43
      ],
      "note": "Collin CAD Access decoder foundation. Shared bounded release parsing and vendor-neutral source records are owned by issue 43."
    },
    "19": {
      "write_roots": [
        "libs/property-tax-adapters/",
        "docs/sources/"
      ],
      "required_cross_issues": [
        43
      ]
    },
    "20": {
      "write_roots": [
        "libs/property-tax-adapters/",
        "docs/sources/"
      ],
      "required_cross_issues": [
        43
      ]
    },
    "21": {
      "write_roots": [
        "libs/property-tax-adapters/",
        "docs/sources/"
      ],
      "required_cross_issues": [
        43
      ]
    },
    "22": {
      "write_roots": [
        "libs/property-tax-adapters/",
        "docs/sources/"
      ],
      "required_cross_issues": [
        43
      ]
    },
    "119": {
      "write_roots": [
        "libs/property-tax-application/",
        "libs/property-tax-adapters/src/property_tax_adapters/objectstore/",
        "libs/property-tax-adapters/src/property_tax_adapters/sources/texas/",
        "libs/property-tax-adapters/tests/objectstore/",
        "libs/AGENTS.md",
        "tests/architecture/",
        "docs/engineering/"
      ],
      "required_cross_issues": [],
      "note": "Application port boundary, bootstrap 2.3. The application package is the subject. Three narrower adapter roots are deliberate rather than a blanket libs/property-tax-adapters/: the S3 manifest serializer must move with the manifest value it serializes, since shipping one without the other leaves a value the writer cannot write; the six Texas county definitions are populated with the expected media types the accepted registry requirement names, which a shared default cannot express; and the objectstore tests cover both. No county layout, parser, or acquisition behaviour is in scope, and no migration is."
    }
  },
  "capabilities": {
    "collin-cad-source-contract": {
      "write_roots": [
        "libs/property-tax-adapters/",
        "docs/engineering/",
        "docs/sources/"
      ],
      "required_cross_issues": [
        43
      ]
    },
    "dallas-cad-source-contract": {
      "write_roots": [
        "libs/property-tax-adapters/",
        "docs/sources/"
      ],
      "required_cross_issues": []
    }
  }
}
